{
  "$schema": "https://json-schema.org/draft/2020-12/schema",
  "$id": "https://local.astra-orchestrator/schemas/project_spec.schema.json",
  "title": "ProjectSpec",
  "type": "object",
  "additionalProperties": false,
  "required": [
    "project_id",
    "project_root",
    "project_context",
    "ultimate_purpose",
    "target_stage",
    "stages",
    "limits"
  ],
  "properties": {
    "project_id": {"type": "string", "minLength": 1},
    "project_root": {"type": "string", "minLength": 1},
    "project_context": {"type": "string", "minLength": 1},
    "ultimate_purpose": {"type": "string", "minLength": 1},
    "target_stage": {"type": "string", "minLength": 1},
    "stages": {
      "type": "array",
      "minItems": 1,
      "items": {
        "type": "object",
        "additionalProperties": false,
        "required": ["id", "goal", "acceptance_criteria", "requires_review"],
        "properties": {
          "id": {"type": "string", "minLength": 1},
          "goal": {"type": "string", "minLength": 1},
          "acceptance_criteria": {
            "type": "array",
            "minItems": 1,
            "items": {"type": "string", "minLength": 1}
          },
          "requires_review": {"type": "boolean"}
        }
      }
    },
    "experiment_plan": {"type": "array", "items": {"type": "string", "minLength": 1}},
    "datasets": {"type": "array", "items": {"type": "string", "minLength": 1}},
    "evaluation_criteria": {"type": "array", "items": {"type": "string", "minLength": 1}},
    "approaches": {"type": "array", "items": {"type": "string", "minLength": 1}},
    "limits": {
      "type": "object",
      "additionalProperties": false,
      "required": [
        "max_sol_attempts_per_stage",
        "max_review_attempts_per_stage",
        "max_transitions",
        "max_model_errors"
      ],
      "properties": {
        "max_sol_attempts_per_stage": {"type": "integer", "minimum": 1},
        "max_review_attempts_per_stage": {"type": "integer", "minimum": 1},
        "max_transitions": {"type": "integer", "minimum": 1},
        "max_model_errors": {"type": "integer", "minimum": 1}
      }
    }
  }
}
